title,review,rating,status,position,location,date_posted,year,month,day
okay to work there,"i have learned alot about managing others, ordering, merchandising.",4,Current Employee,Department Manager ,"Fitzgerald, GA",3/27/12,2012,3,27
I enjoyed working overnighta a s a stocker...,"Back when I first started to work for walmart, it was family oriented. We were allowed to have get togethers , potlucks . contests for whom ever got more pallets done. We would have drawings , lots of meetings , strong communication with the store manager....",5,Former Employee,Department Manager Clovis ,clovis ca.,3/27/12,2012,3,27
fast paced and lots of customer service..,Walmart is a high paced environment with customer service being the number one priority...It offers many opportunities to learn retail. I learned just about everthing there is to learn within walmart. different cultures.I enjoyed working at walmart it has it good and not so good moments as an hourly worker you are able to interact with other worker.. After working so many years for the company you meet lots of different people and coworkers .,4,Former Employee,Assistant Manager Super Center Dinuba ,dinuba ca.,3/27/12,2012,3,27
Fun Work Enviorment,I loved my bosses and pretty relaxed enviorment. I was able to show how much I knew my job by training others and working all around the store,3,Former Employee,Cashier ,"Jacksonville, AR",3/27/12,2012,3,27
A fun place to work,Loved my management team. Fun place to work an I liked puttin money in the stocks,4,Former Employee,Support Manager ,"Pleasanton, CA",3/27/12,2012,3,27
Good Job Nice People,I loved working at Wal Mart. I made a lot of friends and still continue those friendships to this day. You are always busy. Time goes by quickly. I was pregnant while I worked there and they were very accomidating.,4,Former Employee,Cashier ,"Saint Clairsville, OH",3/27/12,2012,3,27
a place to practice customer service skills and money handling,"working at walmart helped me in my customer skills, it showed me to smile even if the person was upset, it defuses the situation alittle. i learned to handle issues at the customer service desk and the transactions between both walmart and the customer.",3,Former Employee,Customer Service Associate/ Cashier ,"Tewksbury, MA",3/27/12,2012,3,27
I loved working at this place,This job was the greatest job i ever had. Management and the other co workers were so nice everybody helped everybody we worked as a team always the customers were nice i endured alot of experience in different fleids just frm working here.The pay and benfits were great!,5,Former Employee,Cashier/Customer Service ,"Kearny, NJ",3/27/12,2012,3,27
Productive environment.,"Everyday was different when I worked on the sales floor. The store associates, Zms, Mgrs knew my capabilities from the previous years of being an unloader/ics team, and cashier. Management would come directly to me to get certain tasks and hard jobs done by end of the day/week. I was trusted to get the hard demanding jobs done comparing to my other co-workers based on expierence and work ethic. Co-workers were all different when it came to hard work/fast paste environments. Most enjoyable time i had working with walmart was the seasonal asile modulars. It was different, and fun setting up modulars and working alone to get them done. I enjoyed being put aside to do other projects because there was no distractions.",4,Former Employee,Sales Cashier Unloader Inventory ,"Stafford, VA",3/27/12,2012,3,27
productive learning experience,this was my second job and I enjoyed it.I t.its a great business with great managers and workers.it was my first real world job experience,4,Former Employee,Associate ,"Houston, TX",3/27/12,2012,3,27
That location was good but could be better,Wal-mart was fine it was a little unorganized at times it was hard for them to schedule me.,3,Former Employee,Maintenance-Cashier ,"Country Club Hills, IL",3/27/12,2012,3,27
productive work place,"In the first month of working, I received the honor of associate of the month.",3,Former Employee,inventory control specialist ,"DeKalb, IL",3/27/12,2012,3,27
Very boring place to work at.,"Huge store. A lot of items, you can find anything you want. Customer service is not too good. Prices are not that low.",3,Former Employee,Overnight Stock associate ,"Charlotte, NC",3/27/12,2012,3,27
Fun and stressful,"It isn't as bad of a job as employees claim to say. It's decent wages with decent amount of effort by the employees. Looking back, it wasn't a bad job. Had fun, made friends, and learned a lot about people and employment. Definitely a good job to get started in.",3,Former Employee,SALES ASSOCIATE ,"West Covina, CA",3/27/12,2012,3,27
Not a very good place to work.,They definitely don't care as much about the employees as they do their management. They try to bow down to management but the employees are on the bottom of the food chain for sure.,1,Former Employee,Cashier ,"Rock Springs, WY",3/27/12,2012,3,27
Fun place to work,"I had the opportunity to open a new store with Wal-Mart in the pet department. It was a challenge, but I love a challenge. Overall it was a good company to work for.",2,Former Employee,"Customer Sales Associate, Pet Dept ","Las Vegas, NV",3/27/12,2012,3,27
Excellent Fellow Employees,"The staff is what made the job. Cleaning bathrooms isn't fun, unless you have someone to laugh about messes with.",3,Former Employee,Maintenence / Janitorial ,"Elizabethtown, KY",3/27/12,2012,3,27
Walmart was a productive as well as fun fast paced environment to work in.,"The environment that Walmart has to offer is an very friendly outgoing managing system. Helpful and cheerful associates, Its like a big happy family. (closer then a team)",5,Former Employee,Overnight Stocker ,"Rockwall, TX",3/27/12,2012,3,27
productive and fun,"put inventory away, pick upo my space, talking to the customers and assisting them.learned customer service",5,Former Employee,sales associate ,"Adrian, MI",3/27/12,2012,3,27
Flexible hours,"Good company to work part-time for. Has a variety of different departments to work in , so I have learned a little about grocery, and retail enviroment.",4,Former Employee,Sales Associate ,"Alexandria, KY",3/27/12,2012,3,27
Productive and sometimes Slow.,Wal-Mart was a great place to work and sometimes wishing I could go back. People were nice and interacting with the customers was a great opportunity to learn and put some skills I've learned to read people's body languages to great use. Among that they were very flexible with working around my schooling. The job it self was very easy to me and the training they provided was great for that. But the hardest part for me with Wal-Mart was when there were slow days in the Sporting Goods Department. Sometimes finding things to do were hard with the rules in place and well other departments were territorial.,5,Former Employee,Sales Associate ,"Alexandria, KY",3/27/12,2012,3,27
"Productive and friendly workplace, we work as a team","A typical day at work consists of running a register, checking out the customers and trying to resolve any issues they may have had while shopping in our store. Occasionally, my assistance is needed in other departments as well, helping with customers, stocking freight, etc. I have learned how to handle people in an effective and pleasant way. The management is decent and fair. My co-workers are friendly and helpful. The hardest part of the job is making sure certain things get done in a timely manner, especially when you have to stop and help customers at the same time. The most enjoyable part of the job is working with friendly people, but also the satisfaction I feel when I do my job well.",4,Current Employee,Cashier ,"Bartow, FL",3/27/12,2012,3,27
okay work place,walmart was a good job. working for walmart was a life experience for me and i liked it,4,Former Employee,CASHIER ,"Robinson, PA",3/27/12,2012,3,27
Fun job but specific store was not right fit,I trained at several locations and enjoyed those but when I went to my home store I could tell store manager didn't seem to feel to strong on making the loss prevention department better. Loss prevention manager was great though.,4,Former Employee,Loss Prevention Associate ,"Niles, MI",3/27/12,2012,3,27
very fun work place organized well managed enjoyable staff,great plsce to work benefits ok pays descent overall great place to work,4,Former Employee,Sales Representative ,"Bridgeton, NJ",3/27/12,2012,3,27
Fast paced work environment,Great work place with friendly staff and environment. Glad to be apart of the team.,3,Former Employee,Sales Associate ,"Hinesville, GA",3/27/12,2012,3,27
Decent place to work,Okay place to work. Other employees dont really get along and kind of do what they wish.,3,Former Employee,Sales Associate/assembly ,"Temple, TX",3/27/12,2012,3,27
usually outside working on cars often in other department,go outside check on how many vehicles need to be worked one. I am often pulled inside to work freight or help in other departments.,1,Current Employee,Tire and Lube Technician ,"Spring, TX",3/27/12,2012,3,27
Job of Variety,Fast paced and inventory driven. Great customer service training.,4,Former Employee,Department Mgr & Cashier ,"Lebanon, OH",3/27/12,2012,3,27
none,i really don't have much to say about this company and I don't want to say to much. the benefits are ok if you are full time. it takes alot of hard work to move up,3,Former Employee,Customer Service Associate ,"Hooksett, NH",3/27/12,2012,3,27
Not a very good place to Work.,"Working for Wal-Mart was never easy. The typical day involved stressful hard work, way too fast pace, and more work than could be done by one person. Management was the worst I have ever had. They did not care for any of the workers. We where nothing but numbers on paper. It would have been better if we workers where “Robots” or “Slaves” then we would have under stood the situation.",1,Former Employee,Cart Crew ,"Reno, NV",3/27/12,2012,3,27
"Easy job, management however is unable to perform the job adequately due to lack of proper training.","The particular Wal-Mart in which I am employed is very poorly managed. Not all Wal-Marts are like this. They are unable to keep trained staff because of the way that they manage the store. The management staff was promoted when to salary managers when they store was opened, however they were not trained well enough how to properly do their job, managing.",3,Current Employee,Sales Associate ,"Lynchburg, VA",3/27/12,2012,3,27
Opportunity for advancement,Friendly co-works. plenty of opportunity for advancement.,4,Former Employee,ICS Associate ,"Colonial Heights, VA",3/27/12,2012,3,27
You are always busy!,"There is a lot of work to do and you aren't ever bored. Trouble is, the pay is not so good for someone who has been employed for many years and has established a good hourly pay in the past. This is a good job for someone who is just starting out and needing to get employment experience. The downside is you are on your feet pretty much all day. You definitely need a good pair of shoes!",3,Former Employee,Cashier/Lawn and Garden ,"Greenville, TX",3/27/12,2012,3,27
Friendly environment,Walmart is an excellent place to be employed at because of the different departments they have.,5,Former Employee,Photo Center Technician ,"Iron Mountain, MI",3/27/12,2012,3,27
Not great company,Management was aweful day to day task were demanding coworker were great customers were good,2,Former Employee,CUSTOMER SERVICE MANAGER ,"Woonsocket, RI",3/27/12,2012,3,27
"It was a productive, and fun place to work.","We usually were constantly busy during our shift. Loved to learn departments when I could, and went to the stationary department from being a cashier. I worked hard, and learned quite a bit from that department.",4,Former Employee,Cashier/Sales Associate ,"Phoenix, AZ",3/27/12,2012,3,27
"unorganized, bad at giving directions","bad management, and racial prejudice , needs better management",3,Former Employee,Warehouse Associate ,"Hayward, CA",3/27/12,2012,3,27
Management is very disfunctional!,"My opinion of Wal*Mart is not good. I find that the company does not deliver on promises, Trys to build up their image with false hope. A company full of burned out employees.",3,Current Employee,Frozen Dairy Associate ,"Raleigh, NC",3/27/12,2012,3,27
Fun after school job,"I did enjoy working here, the hours were perfect. My only complaint would have to be the managers. They weren't as involved as they should have been at this particular store. Had to learn everything on my own.",3,Former Employee,Cashier ,"Pooler, GA",3/27/12,2012,3,27
"Handle and process photos including negatives, customer service skills.","Good job, cross trained in every department. Very willing to work with scheduling conflicts. Great co-workers hardest part of job is not having enough help. most enjoyable part of this job is working with the people you love.",3,Current Employee,Photo Center Specialist ,"Madison, AL",3/27/12,2012,3,27
Fast Pace and productive,Poor management and not guaranteed hours neededUnder paid for the work that the employees do.Was not satisfied with the professionalism of supervisors/managers.But it was a job an a paycheck every 2 weeks.,2,Current Employee,Instock Team ,"Frisco, TX",3/26/12,2012,3,26
Pretty Good,There is always room for advancement. The place is always busy so there is always something to do.,3,Current Employee,Zone Merchandise Supervisor ,"Gurnee, IL",3/26/12,2012,3,26
Productive work enviroment with customer satisfaction in mind.,"Working for Wal-mart was a good experience for me, it gave me the opportunity to help others. I learned that giving good service to others make you feel good. The managers were very helpful. The hardest part of the job was knowing that you could not do more for the customer when they come with a questions that only the manager could answer. It was very rewarding seeing people smiling.",4,Former Employee,Cashier ,"Apopka, FL",3/26/12,2012,3,26
"Great Co-workers , Great new people",I loved the fast pace being at this store and the great people i worked with,5,Former Employee,Customer Service Rep ,Norwalk ca,3/26/12,2012,3,26
Good place to work,Work - Home life not balanced. Very stressful most of the time. But overall good place,3,Current Employee,Asset Protection Manager ,"Traverse City, MI",3/26/12,2012,3,26
Fun work place,Fun place to work with a great group of employees. Management is very easy to work for. Not as much flexability as my current position however I worked the 3rd shift. I enjoyed it due to having the afternoons at home with my son however it is a very hard shift to get used to. Walmart does a lot of things for the community as well.,5,Former Employee,Stocker ,"Leesburg, FL",3/26/12,2012,3,26
ok place to wok,It was a ok place to work if you need a job but i would not recommend walmart position to anyone. The managers show racism.,3,Former Employee,Sales Associate ,"Cockeysville, MD",3/26/12,2012,3,26
Productive and fun workplace,Got along real well with the management. Treated employees with respect. Hard work to do but the pay made up for it,4,Former Employee,Forklift Operator ,"Sealy, tx",3/26/12,2012,3,26
always changing but change is good,Nothing is ever in stone and always changes 50 times but tests are good and so is change it keeps you from being stagnant.,2,Former Employee,Assistant Store Manager ,"Madisonville, TN",3/26/12,2012,3,26
Opportunities for advancement for the right kind of person,"When leadership changes direction, you better hold on tight or run to keep up. The salary for most management positions is high compared to other jobs in this state. Just know that you'll be spending a lot more time at the office than with your family, and the dusty cubicles are far from cozy. Expect to go in early and leave late every single day. You'll spend countless hours in pointless meetings and hardly have time for lunch. Don't bother calling ISD when your laptop crashes. Just find the smartest guy in your department and beg for his help. Even if he's on vacation this week, it will still get done faster than going through ISD.You'll be expected to cheer at 7:30 during the Saturday morning meetings. You'll have a company phone attached to your hip at all times, and you'll be guaranteed never to work a standard 40-hour week. There are lots of opportunities to advance at Walmart if business is what drives you, but make sure that's really want you want in life and start looking for a backup plan anytime the CEO changes. You wouldn't be the first one they've ""involuntarily terminated"" after receiving 25 years of excellent evaluations.Some people seem truly happy there, and you may love it. I just think it's important to know what you're getting into on the front end. If you decide to interview for a position with Walmart, ask plenty of questions while you're there.",2,Former Employee,Worker Bee ,"Bentonville, AR",3/26/12,2012,3,26
negative & depersing workplace.,"wal-mart is not the best employer to work for, the customers are great & the co-workers are also, but wal-marts management team is not so great. I feel wal-mart have a very poor management team & system.",2,Current Employee,Sales Associate ,"Mayfield Heights, OH",3/26/12,2012,3,26
...never again,Horrible company. Can only get hired through a temp agency. The agency ripped off its employees.,1,Former Employee,Material Handler ,"Elwood, IL",3/26/12,2012,3,26
Friendly enviorment always meeting new people,Very professional and welcoming for coustomers and employees. Easy to get adjusted and have fun while working. Easy to get promoted and always equal to each associate and department. Very open with open door policy and one can take any problem or suggestion to the proper chain of command and let their voice be heard.,4,Former Employee,Cashier/Clerk ,"Orland Hills, IL",3/26/12,2012,3,26
very versatile place fun to work there,i loved it alot of people and you always saw someone new everyday.,5,Former Employee,Deli Associate ,"Tampa, FL",3/26/12,2012,3,26
productive fast past environmen,"its great places to work only being able to grow was limit . i learned how work with cash , start work do a little stocking then start to check out customer . Hard part was unloading truck . enjoy part was helping customer get what they need in a timely fashion",3,Former Employee,Sales Associate ,"Chicago, IL",3/26/12,2012,3,26
You can shop after work is done.,"They trained me in every department so I can learn new things. You can cash your check, get food and shop all in one place. before you go home.",5,Former Employee,"Sales, clerk, overnight merchandiser / 9.00 hourly ","Corpus Christi, TX",3/26/12,2012,3,26
good company,Place where one can advance and achieve status in a company. Needs to be more flexible with availability.,4,Former Employee,Sales Representive ,"Augusta, GA",3/26/12,2012,3,26
Great place to work,I loved working at walmart. You get to meet new people and the job never gets boring!,5,Former Employee,Sales Associate ,"North Little Rock, AR",3/26/12,2012,3,26
"Enjoy working for the company, employee, management, and customers.","Worked overnight stocker,(in shoe department), inventoried products, processed store merchandise, cleaned receiving area, and organized merchandise, also worked in other departments in the store as needed.",4,Former Employee,Receiving Associate ,"West Monroe, LA",3/26/12,2012,3,26
friendly enviornment,When I worked there the staff were nice and friendly and helpful.,2,Former Employee,Cashier and Customer Service ,"Frederick, MD",3/26/12,2012,3,26
"lunch room, my share, pay scale;benefits","they offer a lunch room, give bonuses called my share which is excellent according to volume of sales, offer lockers , pay is fair and annual evualations is according to your work done in all fairness. hire seniors as well as handicapped personnel. all in all an excellent company to work for . your energy will get you a good promotion and they have discount on emplyoyees purchases which is really a nice incentive.",3,Current Employee,Cashier ,"montgomery , Tx",3/26/12,2012,3,26
"Career oppurtunities,Hours","Great place to work, also area to advance. Full-time hours and a great place to start an career.",5,Former Employee,Customer Service Manager ,"Bedford Park, IL",3/26/12,2012,3,26
Give me an opportunity to grow and rich my goal..,"Wal-Mart is a number 1 retail company in the world. Provide me opportunity to grow. Gave me support to develop my skill in customer service.. Give te opportunity to the comunity find a jobs.Have good cover of benefits..Respect your breacks and luches..Provide a great opportunity to develop our carers. Is a stable company, have many locations, so we can transfer if we need move it..",3,Former Employee,Zone Supervisor Front End ,"Coconut Creek, FL",3/26/12,2012,3,26
Hard work with poor benefits,"Bosses that won't listen, production rates that are almost unreachable, benefits that are horrible.",2,Former Employee,Unloader ,"Ottawa, KS",3/26/12,2012,3,26
A good Place to work,If you are looking for a good experience and a place to try and move on up to better positions walmart is a good place. Its hard to get onto their staff but if you do dont throw away the job. great job!,4,Former Employee,cashier ,"lenoir, nc",3/26/12,2012,3,26
Great Benefits and work environment.,Wal-Mart distribution is a fast paced work environment. I enjoyed my employment there.,5,Former Employee,Retail sales associate ,"Colonial Heights, VA",3/26/12,2012,3,26
Great company.,They started me more than minimum wage. I got 80 hours in a two week period and a hour lunch break. Days off were hard to get but they do work with you.,5,Former Employee,Customer Service Associate ,"Goose Creek, SC",3/26/12,2012,3,26
Demanding and Fast Paced,"As with working in any retail position this was a very demanding and fast paced company. However, management and the treatment of women in the company was less than i desired.",3,Former Employee,Cashier ,"Fort Wright, KY",3/26/12,2012,3,26
A job that keeps you working,I used to love working for Wal-Mart now I just go through the motions to continue having a paycheck while I find something better.,3,Current Employee,Cashier ,"Vidalia, GA",3/26/12,2012,3,26
A challenging work environment that keeps me busy,I love to learn new things and I do it best with hands on learning. I have a large amount of customer service experience. I would not mind working in in customer service again but I'd love to learn something new and have new experience.,4,Former Employee,Customer Service Associate ,"Leland, NC",3/26/12,2012,3,26
productive and fun,good training for the position. Management was nice. Enjoyable job.,4,Former Employee,Sales Clerk ,"Harrisburg, IL",3/26/12,2012,3,26
Nice,"Worked with wonderful people, always looked out for one another never had anything negative to say.",3,Former Employee,Cashier ,"Martinsburg, WV",3/26/12,2012,3,26
Enjoyed helping the associates,I really did like the job that I did at wal-mart in helping the associates . I am a people person,3,Former Employee,"RECEPTIONIST, OFFICE CLERK, ","North Versailles, PA",3/26/12,2012,3,26
Always a new challenge.,"As my career began with Walmart, I would have to admit I was a bit nervous. Big box retail was something I had never experienced. Walmart taught me the value of multitasking and delegation. I learned that a good manager will delegate responsibility to key people in order to get the job done correctly. The only down fall of working for Walmart is that you have no outside life with family and friends. I was at work more than I was home. Missed a lot of family milestones and events due to the ever changing environment of Walmart.",5,Former Employee,Assistant Store Manager ,"Neptune City, NJ",3/26/12,2012,3,26
Time for a change,"Walmart was a job that i started just to start getting money coming in. But once i started i really liked job,customers and being a team player. I was Part-time there so i didn't have any benefits but the management was very helpful and loyal to there employees. I worked there for six years and moved on to my current position at PNC Bank.I enjoyed my time at Walmart but it was time for a change.",4,Former Employee,Customer service associate/Cashier ,"1351 Veterans Pkwy Clarksville,Indiana",3/26/12,2012,3,26
Great place to work at.,Gained lots of retail exp.great co-workers.easy jobs.expect alot from someone.,4,Former Employee,Inventory Control Supervisor ,"eagle pass,tx",3/25/12,2012,3,25
Walmart in Farmington is a fair and fun place to work.,I loved my time at the farmington location. They always worked with me on my hours. Most of management was easy to get along with. Very close knit crew.,4,Former Employee,Cashier ,"Farmington, MO",3/25/12,2012,3,25
Keeps you busy!,The company itself is a great place to work for. Unfortunately the management can be a bit lacking and they pick their favorites. They don't really allow much chance for advancing within the company as you would think.,3,Former Employee,Inventory Specialist ,"Fredericktown, MO",3/25/12,2012,3,25
Poor Management,"The managers never talked to me. they assigned one job, then come back 10 minuets later to give another job. very unorganized",2,Former Employee,Stocking ,"Charlottesville, VA",3/25/12,2012,3,25
