title,review,rating,status,position,location,date_posted,year,month,day
Productive and fun workplace with aadvancement opportunities,"Walmart is a great place to work. they provide multiple opportunities for advancement, and many people make careers here. Walmart always places their employees at the closest location to where the employee lives. Walmart is a fun place to work if you like to deal with the public on an everyday basis.",4,Former Employee,Asset Protection Associate ,"Waverly, TN 37185",2/15/12,2012,2,15
loved the job,loved the job and the people working there loved the benefits and the hours i was working.,5,Former Employee,overnight associate ,"louise sioux falls, sd",2/15/12,2012,2,15
"one thing they tell you that you well get full time. Than they give u 22hrs aweek,they get mad at you for clocking in 2-5 mins early. it use to b fun","they get mad at you for clocking in early 5 -3 mins early. management tell use we have to b on time wich is good,but if you clock out late for helping someone you get in trouble for that.",1,Current Employee,Sporting Goods Associate ,alma mi,2/15/12,2012,2,15
"Personable, Hardworking, Teamwork, Customer Care","They are constantly training us with new information to work better and take better care of the customer. Everyone is important that work with the company. They help the needy and children with school. They help each other in different departments, from the back to the front end.",4,Former Employee,Cashier ,"Greeley, CO",2/15/12,2012,2,15
Fast paced and challenging,I loved working here! It was so fun and the patients were great. You truly get to know each and everyone of the patients and it feels like family.,4,Former Employee,Pharmacy Technician ,"Aurora, Indiana",2/15/12,2012,2,15
"nice, fast, steady work place",I liked working here. I always got to meet new and interesting people. I would love to still work for then part time. I was pregnant and had complications and had to quit,5,Former Employee,cashier ,live oak fl,2/15/12,2012,2,15
Good place to work,Walmart is a great place to work. The Management team really care about their associates.,4,Former Employee,Qa/Systems Associate ,"Carrollton, GA",2/14/12,2012,2,14
Bad place Sam would be disappointed,"Management is terrible, no one wants to listen , pass the buck on everything. I told one I saw someone stealing they said they don't get paid to do security. I was so dissappointed in them. Sadly the open door policy is a sham. You don't feel welcome to talk to any management.",1,Former Employee,"cashier, stocker ",millbrook AL,2/14/12,2012,2,14
mgt is always up and down,"They don't care about there wokers, and there is no open door policy like they said she is.",3,Former Employee,"cashier, customer service managment, ","Rindge, NH",2/14/12,2012,2,14
Nice and Safe PLace to work,The other associates are helpful and handful when you need to leave early just get in contact with your supervisior and you will get the answer you need if you want to come in an extra day just ask and you shall receive.,5,Former Employee,Electronics sales Associate ,"Oklahoma City, Oklahoma",2/14/12,2012,2,14
fun place to work,wal-mart is a place to grow and meet new people you almost could say it is a new family they work with you in good times and bad you can start as a cart pusher and the next thing you know you could me a manager i loved working for them but i let one person get to me and i made a stupid mistake and walked out something i have to live with.,4,Former Employee,inventory control specialest ,"bad axe, mi",2/14/12,2012,2,14
people fun to work with,"Good place to work , work with you on your availibility, Good for part timers",4,Former Employee,Cashier ,Bakersfield,2/14/12,2012,2,14
employment,Walmart doesn't pay alot and want you to do everything. They expect you to never get sick. And they fired me because I missed work a couple of days because my wife was in a high risk pregency trying to miscarry my son. Sorry I felt that I need to be with my wife. But they knew what was going on said they would work with me and then turned around and fired me.,3,Former Employee,ICS ,"Kosciusko ,MS",2/14/12,2012,2,14
Terrific place to work!!!,I loved this place. The atmosphere is wonderful and coming to work here everyday is interesting. There is no telling what you will see. I also love how the company promotes from within. The ability to advance is very easy.,5,Former Employee,Cashier ,"Jefferson City, MO",2/13/12,2012,2,13
Customer Service,Walmart was a very nice place to work. With a lot of growth potential. The only thing I could say negitive is their wage at that time was far less than I need to survive.,5,Former Employee,Customer Service Rep. ,"Cedar Fall, Iowa",2/13/12,2012,2,13
fun workplace,"great place of employment, pleasant work environment, great team to work with, great networking environment",5,Current Employee,optician ,vision center,2/13/12,2012,2,13
love the work place,Wal-Mart is a great retail company to work for. I learn a lot-also i got a chance to meet lot's of people.,4,Former Employee,Cashier/ Customer ,"Fort Worth, TX",2/13/12,2012,2,13
its an okay place to work but not for a career,I like the fact that its a safe place to work at but I do not like the enviornment. I don't like how the schedule up and down. Other then that they have nice friendly people and the management team could be better.,2,Former Employee,cashier ,"las vegas,nv",2/13/12,2012,2,13
All about looking great and staying on top of things.,"Personally, I believe Walmart could improve so much in every aspect. Management was a joke to me. Managers stuck together, but would pretend to care and be on your side when they were alone. They really didn't act like they cared about a lot of issues employees were having. Yes, I had fun at what I did, but it was highly stressful for me.",4,Former Employee,Cake Decorator ,"Bedford, Tx",2/13/12,2012,2,13
Just like a small city.,Most people there are very friendly. Great work environment,3,Current Employee,Sales associate/ Inventory Management ,"Hatfield, PA",2/13/12,2012,2,13
Fast paced productive workplace,"I enjoyed being an employee at walmart because it was a fast paced and productive environment. Working at walmart has given me many skills in many areas of retail. I have excellence cash register expierence now. While working at Wal-Mart I had the oppourtunity to also be a customer service representative. While working at the service desk I learned to take calls, do returns and exchanges, cash checks, and do money orders.",3,Former Employee,Cashier/ Service desk ,Roanoke Tx,2/12/12,2012,2,12
Favorite Job,I loved working as a cashier. I got to meet tons of wonderful people and I learned tons of customer service techniques. I learned how to sell credit cards and products to customers and persaude them to come back.,4,Former Employee,Cashier ,Michigan,2/12/12,2012,2,12
Great oppertunities,Hours are available to fit any schedule. Many different options for areas to work in. Learn new skills and work with tons of different people.,5,Former Employee,Customer Service ,Fenton and Clovis,2/12/12,2012,2,12
good work place,good benefits ok wagessome bounces are very gooddiscount is goodno specfic job you may work at any position,2,Former Employee,associate ,"fort st john, bc",2/12/12,2012,2,12
"Family atmosphere, exciting place to work,","I enjoyed working for walmart for the time I was there, just wish it was more of a permanent position and more pay",5,Former Employee,Sales Associate ,"Perris,CA",2/11/12,2012,2,11
Productive environment with alot of positive attitudes from employees.,Fun workplace all the permanent employees seemed to know their store and position well.,4,Former Employee,Overnight Remodel/Set-up Crew Member ,"Stockton, California",2/11/12,2012,2,11
Horrible Place to work,The management was rude they give you hardly anytime to finish work in your area and they are not on page with each other at ALL.,1,Former Employee,Stocker ,"Porter, Tx",2/11/12,2012,2,11
Don't even want to give 1 star.,"Very disapointing. Poorly managed. Bad benefits. Horrible scheduled one week 32 hours, the next 40. You can't budget yourself because of the constant changing schedule. Management unfair. Certain people can break policy, others cannot. Do not follow through. Too much gossip. Too many ""clicks"". Smokers get extra breaks. Including managers. Manager's have their favorites. Always have to watch your back....someone is always out to stab it !!",1,Former Employee,ICS ,"Sussex County, NJ",2/11/12,2012,2,11
I very good work place,"Ever since i worked for walmart i loved it, even though i was a cart pusher I liked my job. I liked the people i worked with and the new people i was meeting.",5,Former Employee,Cart pusher ,"Starke, FL",2/10/12,2012,2,10
Productive and Friendly place to work,Was overall a positive place to work their main focus was for their customers and what they wanted and would do their best to make sure every customer left happy and satisified.,2,Former Employee,Frontend Associate/Pharmacy Tech ,"Northeast, MD 21901",2/10/12,2012,2,10
shipping and receiving,not a bad place to work start pay is not bad the managers can be hard to get along with it seems like they accept so much from you paid every two weeks can advance as long as you want to and show interest,3,Former Employee,shipping and receiving ,Salem NH,2/10/12,2012,2,10
Productive and independent,Very laid back but a shortage of supplies. Constantly searching for the equipment required to complete a task.,4,Former Employee,overnight Receiving associate ,i35 in round rock,2/9/12,2012,2,9
retail enviroment with speicalites,"walmart is your tipical retail operation,nothing speacal about it. personally i would not recomend to anyone,simply because of the way the store is run.the one good thing that i can say about walmart is they pay better than any oyher retail store.",3,Former Employee,stock person/sales associate ,"cincinnati,ohio",2/9/12,2012,2,9
"Walmart was great, fast pace place to work.",Working with Walmart you had good job security and plenty of advancements to move up. Great people to work with. Management was very respectable.,4,Former Employee,Recieving Unloader ,"St James, MO",2/9/12,2012,2,9
Fun work place and lots of safety awards,I had many oppuntinties to advance in the company. The management was supportive. I enjoyed the position that I held.,5,Former Employee,"Baker, Meats &Seaford Dept, fashion Supervisor ","Opsery, Florida",2/9/12,2012,2,9
Hectic workplace,"Schedule was very crazy, money wasn't worth the work and hours.",3,Former Employee,Cashier ,"Memphis, Tn",2/8/12,2012,2,8
Fun place to work,I love working here. I loved meeting the customers and the store's atmosphere.,5,Former Employee,Part Time Salesperson ,"Lumberton, NC",2/8/12,2012,2,8
The Big Box,Job security and benefits are satisfactory. The best Big Box retailer to work with.,4,Former Employee,Courtesy Associate ,"Colonial Heights, Va",2/8/12,2012,2,8
Payed The Bills,"I worked grave shift stocking, the hardest bit was staying awake. It was a simple job put stuff on the shelf the benefits were ok and the team moral was ok it payed the bills couldn't keep much of a social life working nights though.",3,Former Employee,Over night stolker ,Corona CA,2/8/12,2012,2,8
Fun working places,I enjoyed my time working for walmart for a good two years. They have excellent customer service positions and a great feeling of have a family working enviorment,5,Former Employee,customer service/ cashier/sales ,"2727 Dunvale Rd, Houston,TX",2/8/12,2012,2,8
productive and fun workplace,very busy work and productive. always something to keep u busy. sometimes long hours and very busy. and not a lot of down time which is good.,4,Former Employee,cart pusher ,talllahassee fl,2/8/12,2012,2,8
Not the same,Walmart has in my opinion an identity crisis. They do not know what they stand for. Rather than focusing on prices they raise prices and reduce associates in the store,2,Current Employee,Co-Manager ,Kentucky,2/7/12,2012,2,7
Great Job Security,"Working at Walmart is something different. The job security is definitely there because the store is always going to be busy! That's where it interferes with your personal life, but its up to you how you want to separate the two. I feel that I didn't get paid enough to do my job but I still loved going in everyday. Great place to work for job security and advancement.",4,Former Employee,Sales Associate ,"Cypress, TX",2/7/12,2012,2,7
Say what ??,"None of the managers know what they're doing. They give you directions then 1/2 way through they change their minds and you have to start over. Market manager is included. They are heartless. Will not approve days off if they don't like you. Over-ride your availability, then coach you if you can't work your scheduled hours !!! Loss Prevention associate's lie.",1,Former Employee,Lawn & Garden Assoc. ,Flanders,2/6/12,2012,2,6
I worked as an optician,"I enjoyed where I worked. I worked full-time, I did not partake in benefits. I left for work search in college degree",4,Former Employee,Optician ,Vision Center,2/6/12,2012,2,6
Productave and fun place to work at,this job was mostly a good experience i would have to recommend it to friends as a good place to work for.,5,Former Employee,customer service manager ,"tampa,florida",2/5/12,2012,2,5
Work with good and fun people,It can be easy and hard at times. We always work together as a team and get our job done correctly.,3,Current Employee,Dry Grocery/Gm Stocker ,Pekin,2/5/12,2012,2,5
work customer service,"i work behind the customer service desk, helping customers and selling tobacco. i did money grams, made copies of keys, and rented the rug doctor out to customers.",5,Former Employee,smokeshop cashier ,"mesa, az",2/5/12,2012,2,5
walmart,i im a good worker love to work it was a ez job all around work noa stop work all of carworker love to work wit me thay ssay im a good in fast worker•keep your review focused on the company as an employer,5,Former Employee,its a good job ,l.a,2/4/12,2012,2,4
Great Place to start out,Working here was the best financial thing that ever happened to me. I'm thankful that I work here and take pride in my job. I have learned so much working here in my seven years. Wal-mart has really set forth a great path for me and my career opportunities.,4,Current Employee,Area Manager ,Robert La.,2/4/12,2012,2,4
Busy and different work place,"I expected Walmart to be open to my school schedule and they where not. They always over-rid it. They managers also had favorites with i do not believe to be far, so if they did not like you even if you did your work, you still got in trouble. My fellow associates where great though and i love them and my customers.",2,Former Employee,Head Jewelry Coordinator ,"Carlyle, Il",2/4/12,2012,2,4
"The pay was great, but I thought my managers and supervisors may not have taken me seriously.",I thought this job wouls have been fun and sometimes it was. I just felt like I wasn't a part of a team and ended up doing most of the work.,3,Former Employee,Overnight Stock ,"Williston, Vermont",2/3/12,2012,2,3
"Walmart was a fast moving, people oriented job and you have to love the public and understand different cultures and values",I enjoyed my job and all the seasonal opportunites that was included in my work. When changing from one season to the next was exciting. Getting to know all type of people and their views were outstanding. Our job envolved team work and i had a lot of good workers working with me. So my job was well thought out before preforming.,5,Former Employee,Zone Merchandizer Supervisor ,Zachary La,2/3/12,2012,2,3
Fast paced productive and fun work place with a good team behind you,"I had a wonderful time working there,fast paced, great employees,fun work environment...All in all a great place to work",4,Former Employee,TIRE LUBE EXPRESS SALES ASSOCIATE ,"LAS VEGAS,NV",2/2/12,2012,2,2
The Pay is reasonable and they like to promote within the company,"Alot of people have mixed feelings about Walmart and the way they treat their employees. I have been working there for a while and overall, I would say its a good place to work; especially if you already have experience! If you're looking for extra cash or a career in retail, Walmart is not a bad place to start.",4,Current Employee,Cashier/Customer Service Supervisor ,"Canton, MI",2/2/12,2012,2,2
OKAY place to work.,"I enjoy most of the people that I work with, but management is a complete joke, and it is a very unorganized company (at least at the one I work at).",2,Current Employee,Inventory Control Specialist ,Washington state,2/2/12,2012,2,2
very nice place to work,i loved it there i would still be there if my car wouldnt have broken down,5,Former Employee,electronics ,winnsboro la,2/1/12,2012,2,1
Working at Wal-Mart taught me skills like teamwork and better communications.,"At Wal-Mart I Receive, store, and issue materials, equipment, and other items from stockroom, warehouse, or storage yard. Keep records and compile stock reports. Also operator the forklift.",4,Current Employee,GM unloader ,"Gonzales,LA",2/1/12,2012,2,1
Loved this job........most of the time!,"Working for Walmart was enjoyable. I liked the flexabilty it offered, on the job traning and the chance to advance or change depts.",4,Former Employee,"Cash Office, Cashier ","Jerome, ID",2/1/12,2012,2,1
Solid establishment but managers lacked competence,"While working at WalMart I was able to experience the changing of supervisors when a new WalMart opened, which was a rough transition from level headed supervisors to incompetent ones and in turn led to many people quitting or hating their job.",3,Former Employee,Courtesy Associate ,"Amherst,New york",2/1/12,2012,2,1
Its a job,"I took a job at walmart when the economy went bad in 2008 because they were the only ones hiring at the time. I spent almost 4 years there and most of the time it was horrible. Always having to walk on egg shells because management is quick to fire people. The pay is VERY VERY unfair for what you have to do and put up with. When walmart as a company says they are competitive with other companys, NO NO NO they are not. Dont get me wrong if your ok with being paid peanuts for long hours then this is the job for you. My coworkers were good people and fun to be around for the most part.",3,Former Employee,Meat department sales ,"Mesa, AZ",2/1/12,2012,2,1
Rewarding and Fun place to work,"Walmart is a great place to work. The staff is friendly and they have great benefits. It is a great place to meet different types of people, and to acquire new friendships or follow up on old ones. Walmart is fast pace and it caters to its employees.",4,Former Employee,Photo Lab customer service rep ,"lafayette, la",2/1/12,2012,2,1
Fast paced,I like working for a big company because there is always something to do. It is a fast paced environment and I really enjoyed all 3 positions I held there. Claims was my favorite though.,4,Former Employee,Sales/Receiving/Claims ,"Vancouver, WA",2/1/12,2012,2,1
Good Company,Stable and innovative company. Consistently changing processes and procedures to meet the needs of its customers.,3,Current Employee,Assistant Manager ,"Memphis, TN",2/1/12,2012,2,1
fair company room for advancemnt,great company to work for only left because cause of family illness .chance for anyone to advance if the desire is there,5,Former Employee,asst. manager ,serveral state,2/1/12,2012,2,1
Comfortable workplace,"Walmart gave me the opportunity to experience a job, even though the job was temporary, I learned many new skills such as dealing with customers and understanding managment and what is required to recieve gratitude.",5,Former Employee,Cashier ,"Brownsville, TX",2/1/12,2012,2,1
Lacking in stocking of merchandise.,They would frequently run out of bags especially the very small and very big bags. When we needed those sizes most we wouldnt have any. Sometimes shelves werent organized and things were everywhere and not very appealing to customers.,3,Former Employee,Cashier ,"Milwaukee,WI",1/31/12,2012,1,31
Effective sales and customer service positions,"I enjoyed my experience working at Walmart! I was able to utilize my excellent people skills through contact with coworkers, administration, vendors and most importantly customers. Great place filled with excitement and desire to reach higher goals. Honesty and Integrity are of the utmost importance at Walmart.",5,Former Employee,Customer Service / Cashier ,"Turlock, CA",1/31/12,2012,1,31
I learned how to b a team player and support my team members.,I learned a lot in a short period of time at Walmart that was to my benefit but I also learned that there are some companies that do not have fundamental respect for the people that work for them. There is a lot of abuse that goes on from the top down to where I worked at the bottom. There was no organization in many parts of my store and that could be felt by everyone working there.,2,Former Employee,Cashier ,"Pflugerville, Tx",1/31/12,2012,1,31
Very nice envirment to work at the people there remember when you worked there.,The job was always a busy place to work cause of all the things that need to be done in the work area had a specfic time to be done and the whole was done as a team.,4,Former Employee,Sales Clerk ,"Houston, Tx",1/31/12,2012,1,31
Cashier,"customer service, I handled the money, and greeted the customers and keeped my area cleaned stocked when needed",3,Former Employee,"cashier, sales ",rockwall tx,1/31/12,2012,1,31
A cornerstone of America,Wal-Mart is a Fortune 500 company. This is a place to meet all kinds of people. Like most companies Wal-Mart is full of opportunity but with a price to pay and that is hard work,4,Former Employee,Customer Service Manager ,"Huntsville,Alabama",1/30/12,2012,1,30
Not as bad as you think,"Forget the stereotypes. Walmart is a great company to work for if you are someone that works hard and can think on their feet. When I lost my job, Walmart was there to help me transition from part time as my second job to full time. The pay is the only downfall. Unless you are salaried management or put in the years to earn raises, it doesn't add up.",4,Current Employee,Deli Department Manager ,"West Bend, Wis.",1/30/12,2012,1,30
"Productive, learned alot",like overall concept of store but managers at that time didn't follow.,3,Former Employee,"sales associate, visual displayer, dept manager ","Junction City, KS",1/30/12,2012,1,30
"Overworked, underpaid and under appreciated","Before we start I need to say that I quit and did not get fired so I am not spiteful towards the company because they fired me. The pay and benefits are bad. There are no merit raises, just annual raises. The highest raise you can get is 60 cents/year, but I only knew of 2 people getting that in the four years and three months of working there. Almost everyone gets a 40 cent raise. Management was a joke. Politics NOT performance is what determines who gets promoted. It is solely the store managers decision, and if you work third shift, he/she will not know you. There are no set hours and they expect you to revolve around wal-mart and expect you not to have a personal life. You can help them, but do not expect it in return if you need it. They cut hours for any reason (some full time down to 28 hr/week others no higher than 32 hr/wk and part time cut down to around 20 hr/wk), but you will have to work five days a week to get those hours because they give you four hour shifts and do not change it for you. They make you do anything that is needed (ex. push carts, cashier, clean toilets, work in frozen or dairy) no matter where you are supposed to work, and if it is a higher pay rate, you won't get paid that pay. I worked all shifts at Wal-Mart. All in all it is a horrible place to work and it is just there to get the CEO more money in his pockets.",1,Former Employee,Sales Associate; Overnight stocker ,"Greenfield, IN",1/30/12,2012,1,30
Not fun to work at all.,Overall dirty place to work the employees a'rent happy to work there. The wages are low and the customers are very rude.,1,Former Employee,Lube tech ,meridian Id,1/29/12,2012,1,29
"This job had too much turnover, low expectations, I found myself not ""cultural in touch"".","The turnover was the biggest problem because there was many times where nobody could assist me on tasks involving more than one person. Poor morale also contributed to problems, although in the begininng morale wasn't a big issue. My supervisors really weren't that involved with me enough and I found that not really anybody in the store guided me enough to make my job easier. Favorability was also a factor, especially with the people that moved up in the company. I felt that I was not the right fit with the company and wasn't showcased in the right way.",2,Former Employee,Cartpusher/Stock Associate ,"Ontario, OH",1/29/12,2012,1,29
Excellent work experiences,Lots of Community involvement.Continued learning opportunities.Advancement opportunities.Excellent bonuses.Benefits options where good.,5,Former Employee,Associate/Cashier ,"Mobile, AL",1/29/12,2012,1,29
Wal-Mart does not stand behind their supervisors.,The company overall can improve upon salary for those individuals who are certified and skilled in their craft. Yes the customer is always right however they do not stand behind their employees when its obvious the customer is trying to get over on the organization. Management is not strong nor or the company benefits. There is favortism with some management people.,3,Former Employee,TLE Express Service Manager ,"17650 N.W. 2nd Avenue Miami Gardens,Fl 33169",1/28/12,2012,1,28
