title,review,rating,status,position,location,date_posted,year,month,day
I spent 20 years at Walmart.,This was my first job and I worked in just about every postion in the store.,4,Former Employee,Pharmacy Technician ,"Fulton, MO",3/12/12,2012,3,12
It was a good job,"I was able to work with the public, and do different things. I went from part time to full time.",4,Former Employee,Cashier then floor attendent ,"Ashtabula,OH",3/12/12,2012,3,12
Great place to work,"Big retail store with alot of opportunities, great and exciting people to work with.",4,Former Employee,Cashier ,"Houston, TX",3/12/12,2012,3,12
Customers that were friendly,The working place was not all that great. The co workers were rude some days.,3,Former Employee,cashier ,"beaufort,sc",3/11/12,2012,3,11
customer service,I really enjoyed my stay at Walmart as a Casher. Iwould love to work part time anytime. I love working with customers and strive at customer satisfaction.,4,Former Employee,Cashier ,"Charleston, SC",3/11/12,2012,3,11
Fun place to work,"I thoroughly enjoyed my time here. They were very friendly and because I am in school, they were very flexible with my schedule.",5,Former Employee,Sales Associate ,"Greensboro, NC",3/11/12,2012,3,11
Welcoming environment with room for advancement.,"This company is very upfront about pay, benefits, and scheduling. There are clear policies about nearly everything, so it is simple to find work related information. I like how the schedules are posted three-weeks in advance, so there is ample time to make arrangements for a personal life outside of work. CSM's will generally work with employees whenever possible, i.e. register preference vs assisting with various tasks throughout a shift.",4,Current Employee,Cashier ,"Knoxville, TN",3/11/12,2012,3,11
"Ethical company committed to respect, customer service and excellence","Walmart values respect for the individual, great customer service and striving for excellence. Only through private ownership are they able to commit to every day low costs and provide every day low prices for the customer.",5,Current Employee,"Specialist, Health & Wellness Compliance ","Bentonville, AR",3/11/12,2012,3,11
It was a rewarding place to work.,"There was no day that was ever the same. Some of the policies for returns were not the best of policies , which made some of the returns and it's customers a bit challenging.",3,Former Employee,Customer service ,"Prince Frederick ,MD",3/11/12,2012,3,11
fun enviroment,A great family orriented enviroment. Very fast paced atmospher,4,Former Employee,Cashier ,"Middletown, NY",3/11/12,2012,3,11
Family Oriented,It is a good atmosphere to meet new people. Keeps you moving in your area to make sure its shoppable.,3,Current Employee,Cashier ,"Monroe, LA",3/11/12,2012,3,11
Productive and a fun workplace.,"Great atmosphere to work in. Great benefits, fun place to work.",5,Former Employee,Sales Associate ,"Evans, GA",3/11/12,2012,3,11
If you do not want to get appreciated this is the job for you.,Somewhat a decent place to work. Easy to learn various departments.,1,Former Employee,Electronics associate ,"Abilene, TX",3/11/12,2012,3,11
An interesting place to work for,Its a very busy environment and very for the customer. A lot will happen in a shift. There is 401K and ability to buy shares of stock. benefits are only after there a year full time.,4,Former Employee,Cashier ,"Queensbury, NY",3/11/12,2012,3,11
Fun workplace,Walmart is a fun workplace as far as working with all the different type of customers. My coworkers not including management were very friendly & open to helping with any question I had. All coworkers were team players & extremely friendly.,2,Former Employee,Casheir/Customer Service ,"San Antonio, TX",3/11/12,2012,3,11
Pleasant and exciting place to work,"No matter where you go, there is always a Manager there on hand to lend support as required. Great place to work.",4,Former Employee,Cash Office Accountant/Cashier ,"St. John's, NL",3/11/12,2012,3,11
fun,when I worked for Wal-Mart it was a fun time granted it was a temp job but I enjoyed it,5,Former Employee,Re-Modeler ,"Cameron,Mo",3/10/12,2012,3,10
Good place to work.,Great management team. good hours. decent pay. good benefits. i worked as a cashier and loved it. i enjoyed the conversations i had with my customers. had i not recieved an offer i couldnt refuse i would still be here. they work with you as much as possible with your hours. i am still in contact with my managers and respect them greatly.,4,Former Employee,Cashier ,"Leesville, LA",3/10/12,2012,3,10
productive work place,"It was a great place to be able to move up in the company, employees are very friendly.",3,Former Employee,Asst. Mgr ,"Abbeville, LA",3/10/12,2012,3,10
"Started great, ended horrible.","Ahh Walmart. I started as a temp associate in the Garden Center. Being only 18 this was a good opportunity. After 3 months, they decided to keep me based on performance, and moved me to Sporting Goods. I remained here 7 years. It was a great job, but offered very little challenge. Then I was promoted to Backroom Supervisor. Being in this management position, I quickly realized that each manager had their own selfish endevours. There was LOTS of fraternization. Favortism, racisim. Pay was not based on performance. In fact, most of the time evaluations were done blindly but people whom you hardly ever seen. They looked for any reason to fire anyone who was full time. Went to a computer program that set up tasks and hours of assignments for you. But then only scheduled you 4, 8 hour associates, and gave you 60 + hours work of work! Then scolded you for not getting it done! VERY POOR. Oh yeah, and they cut hours so bad at winter time, I went from 35 plus hours to 4 hours per week. Oh they couldn't afford it!! BULL",2,Former Employee,Inventory Supervisor ,Michigan,3/10/12,2012,3,10
Overnight worker,Overnight position that demanded up to unload and arrange the items on selves.,4,Former Employee,Overnight Stocker ,"Burlington, NJ",3/10/12,2012,3,10
It was a fast past job,Had the opportunity of making more money and thy would not over look youre work.,5,Former Employee,Order Filler ,"McCarron, MI",3/10/12,2012,3,10
"Fun place to work, management is understanding and accommodating","I loved working for Walmart. They train you very well, the workplace is relaxing and comfortable.All the employers are like one big family.",5,Former Employee,Cashier ,"Lynn, MA",3/10/12,2012,3,10
Bullmess,Worst place I ever worked for... They dont care about their employees even slightly... They talk a big game but thats all it is... TALK!,1,Former Employee,Sales Associate ,"phenix city, Alabama",3/10/12,2012,3,10
always something new,"I enjoyed working at Wal-Mart. Friendly co-workers and a full hour for lunch, a definite plus.",2,Former Employee,Customer Service /sales associate ,"Jasper, AL",3/10/12,2012,3,10
productive,"Bad Management! However the associates made due with what we had. I often travel from store to store to help. It made me appreciate working in the store that I was based, but found out that the pay was not the same for the job. So not fair.",4,Former Employee,Over Night Receiver ,"Pearl, MS",3/10/12,2012,3,10
Morning Flow Team,I work stocking on shelves and unload the truck. I also wanted to help guest out.,5,Former Employee,Cart Collector ,"Arlington Heights, IL",3/10/12,2012,3,10
work as needed,"It is a retail company, therefore hours of work are as needed per business. Scheduling days off can be a hassle especially if you're a student or family oriented.",3,Current Employee,Assistant Manager ,"Athens, GA",3/10/12,2012,3,10
"Lots of opportunity, stresses of high volume retail",This is a chance to view operations of the world's largest retailer. Lots of resources with a good bit of pressure to produce. Huge stores with many different jobs allow people to work themselves into jobs that suit their talents and tastes.,3,Former Employee,"Support Manager, In-Stock ","Sarasota, FL",3/10/12,2012,3,10
It was enjoyable and an easy job,"You are placed in the area that best fits your qualifications and can learn many departments until find one best for you,providing the management team is a strong one. Worked for two walmarts and second one not very impressive.",4,Former Employee,"CSM,LAYAWAY,SERVICE DESK,INVOICE OFFICE ","FRISCO CO, AND EFF. ILL",3/10/12,2012,3,10
fun place to work,i love working with staff of walmart. but the management shoud respect to employs more.,4,Former Employee,tire and lube associate ,jennings luisiana,3/9/12,2012,3,9
Fun place to work,Enjoyed helping many customers and meeting many other co-workers,4,Former Employee,cashier ,"Pueblo West, CO",3/9/12,2012,3,9
awesome,working there was fine the people were great i even met the motherr of my child there the pay was not great,5,Former Employee,unloader ,ofallon mo,3/9/12,2012,3,9
I had fun working as a cashier and a stocker,I had fun working as a cahsier and waiting on customers. I also had fun stocking shelves.,5,Former Employee,Cashier ,"Onalaska, WI",3/9/12,2012,3,9
Decent for a time.,"Walmart isn't a bad place to work, as long as you know what you're going into. The hours aren't bad, dealing with people generally isn't too terrible. Just hope that you get a great manager.",3,Former Employee,Electronics Associate ,South Carolina,3/9/12,2012,3,9
3rd shift independance,"Wal-mart was a good company to work for, 3rd shift was the only option for me at the time having a young child. I liked the independance and accountability of the job",3,Former Employee,Overnight stocker ,"Pittsfield, MA 01201",3/9/12,2012,3,9
Productive and fun workplace with great hours.,"I loved working here, the hours were not very flexible but the people were nice and the environment was busy busy busy, which I loved.",4,Former Employee,Sales Associate ,Dickinson ND,3/9/12,2012,3,9
large company,"walmart is a good company to work for, there will always be a job with walmart. they have flexible hours and managers who work with your scheduling needs.",3,Former Employee,overnght stocker ,"Conyers, Ga",3/9/12,2012,3,9
Worse place to work,Managers dont care about workers. Even if its health issues they dont care and want you to work.,1,Current Employee,Sales ,"Orlando, FL",3/9/12,2012,3,9
Great career to be had at Wal-mart,"My time spent at Wal-mart was very rewarding. There is a good atmosphere, great people, and tons of opportunity. Wal-mart is always pushing the envelope and looking for ways to deliver a better shopping experience.",4,Former Employee,Store Manager ,"Manville, NJ",3/9/12,2012,3,9
Very cut throat,"Once you enter management your family comes second. Regardless of how well you do, it will not refect on your eval.",2,Former Employee,Regional Center: Operations ,Bentonville,3/9/12,2012,3,9
Fun Place,I had a great time working in the Accounting office at Walmart. I was able to learn some basic functions of Accounting while I was still in college.,3,Former Employee,Accounting Associate ,"Baker, LA",3/9/12,2012,3,9
Just an average high pressure job,"Substandard health insuranceNo work life balance, work too many days in a row with little time off...Non professional management running and directing the pharmacy operation",3,Current Employee,Full-time staff pharmacist ,"Bayou Vista, LA",3/9/12,2012,3,9
Exciting adventure,"Fun place to work , exciting , great benefits, meet new people, can advance with the company , stock options",5,Former Employee,ZMS ,ridgeland ms,3/9/12,2012,3,9
Good place to work for,Have worked several different departments with Wal Mart. 10 percent discount on merchandise from the store,4,Former Employee,CUSTOMER SERVICE ,"Lewisville, TX",3/9/12,2012,3,9
"Busy, busy, busy","With this job there is room for advancement and always something to do. If you have the desire to work this is the place and they also have a good setup as far as sick time, vacation, and benefits.",4,Former Employee,Overnight Supervisor ,"Zebulon, NC",3/9/12,2012,3,9
extremely busy with business oriented work ethic,"Busy employer. Great computer system. However, minimal interchange with the public due to workload.",4,Former Employee,Staff Pharmacist ,"Cincinnati, Ohio",3/9/12,2012,3,9
No time to Stop,Wal-Mart is pry one of the worst place that I have ever worked. All the employes are vary unhappy they hate their job and feel like they are slaves to their job and are treated realy bad by the management. Most of the staff that works over night are looking for new jobs or have been there so long that they feel they can not find a job that pays as much and dont want to do any thing to risk there jobs.,2,Current Employee,Maintenance Associate ,"Vestal, NY.",3/9/12,2012,3,9
Great co workers,"This was my first job and it was cool after I got dark from pushing carts, but overall this job was a stepping stone",3,Former Employee,STOCKER ,"LAKEWOOD, CA",3/9/12,2012,3,9
"Walmart is a go to work do your job, and leave type of place.","In my experience working at Walmart was a very proccessed area of work. I worked with older women that seemed to not like the idea of any competition especially from the younger generation. myself along with other and previous young employees had been harrassed, insulted, and told to complete taskeds in ways that were in fact wrong. This later lead to strikes against me and eventually termination. Walmart is a very hostel work enviroment, people not only in the deli but throughout the store lack the presents of manners and friendlyness. Store No. 5155.",3,Former Employee,Deli Sales Associate ,"Las Cruces, NM.",3/8/12,2012,3,8
Fun place to work,"Great place to work, if you get into a good store. Team spirit and lots of engagement when you get a good team.",4,Former Employee,Customer Service Manager ,"Reno, NV",3/8/12,2012,3,8
Great place to work,Great place to work. Not much room for advancement. Needed to be a little more lenient with having to miss work to be at the hospital though.,5,Former Employee,Inventory/Stock Clerk ,"Jefferson City, MO",3/8/12,2012,3,8
Lack of respect and sincere acknowledgement of employees,"Management personel that I encountered never followed through with discussed issues. These ranged from established work schedules, assurances of transfers, to waiting weeks on urgent needed work supplies (such as hair nets). Fellow employees complained constantly of short staffing and more and more cut hours.",2,Former Employee,Sales Associate ,"Spring Hill, Fl.",3/8/12,2012,3,8
Worked with good people and got along well with everyone.,"I liked my job there, it was fun to work there and learned more on how to do the cash accounting on the computer at the end of the shift if I closed. Had repeative customers that were very greatful with our customer service.",4,Former Employee,Customer Service Manager ,"Maryvale, AZ",3/8/12,2012,3,8
I love working with people,"I love working at wal-mart, especially with the people the only think i didn't like was there was no room for job advancment",4,Former Employee,Cashier ,Lafayette La,3/8/12,2012,3,8
Great people to work with.,Plenty of room to grow if you work with the right people. Coworkers are great people. Management are by the book.,4,Former Employee,ICS ,"Clarksville, IN",3/8/12,2012,3,8
"Enjoyed working with the public, even tough hectic at time due to short staffing, I very much enjoyed the fast paced atmosphere.","Working for Walmart gave me the experience and the opportunity to grow within the company.I enjoy a fast paced environment so being able to take on more that one task at a time was never difficult. I was always happy to be able to take that ""not so happy"" customer and turn it around into a positive. I have strong customer service skills and never turned down the chance to learn new things.",4,Former Employee,Customer Service Manager ,"New Hudson,Mi",3/8/12,2012,3,8
fun place to work,"its fast pace, good seasonal job which can turn into a full time job",5,Former Employee,Electronics ,"Grants Pass, OR",3/8/12,2012,3,8
Great place to work but the pay is horrible,"I suppose if your a single person or if you're with someone who is also working then this job is fine. but for me personally, being the only one in my household working, this was an unsatisfactory job for me in terms of pay.",3,Former Employee,TLE Service Writer ,"Indianapolis, IN",3/8/12,2012,3,8
Fast Pace,"Company seems a little hard to please, but they do pay well. Benefits are alright can't complain.",3,Current Employee,orderfiller ,temple tx,3/8/12,2012,3,8
good,"You meet, work, and help alot of people if different backrounds.The pay is good.",3,Former Employee,cashier ,"florida city, fl",3/8/12,2012,3,8
Great place to work,"wonderful placed to be employed, all employee's came together when needed to resolve issues or help others when needed.",5,Former Employee,Department manager ,"Bedford, TX",3/8/12,2012,3,8
its just a job,"My co-worker are easy to get along with, but management sucks. Management can care less about the employess.",2,Current Employee,Cashier ,"Secaucus, NJ",3/8/12,2012,3,8
Fun yet somewhat stressful workplace,Wal-Mart was fun to work for in the beginning but the longer I worked there the more stressful it became. Some employees seemed a bit uptight so there stress was passed on to others.,4,Former Employee,TLE Service Writer/Greeter ,"Jackson, TN",3/8/12,2012,3,8
Never again...,I started at Walmart in high school that's when the company was fun to work at. I started at the College Drive store then later ended my career there at the Denham Springs location. Some of the people there were fun to work with while others would go around harrassing you for no reason. I think Walmart is a great job for anyone needing part time work because they do not vaule family or they don't even try and help people that are students.,1,Former Employee,Customer Service Associate ,Denham Springs,3/8/12,2012,3,8
fun workplace,"was at Walmart for 3 and a half years i enjoyed being in all different departments. started off in Toys but was able to help in Seasonal, Pets, Sports and Hardware Department. Was moved to Fashions which i zoned clothes and in Infants helped with strollers, car seats, and cribs. And also was moved around to help in Jewellery, Cosmetics and to help with the til when busy!",3,Former Employee,Fashions Associate ,Terrace BC,3/8/12,2012,3,8
A very fun place to work,"Love working at wal-mart, management awsome, Pay great, and it was so much fun, But it do take your life",5,Former Employee,Stocker/Zone Associate ,Goose Creek Sc,3/8/12,2012,3,8
Productive and Fun Work place.,This location is fairly new so it has a awsome crew. All employees are very friendly and inviting.,5,Former Employee,Service Desk Associate ,"Auburn,Wa",3/8/12,2012,3,8
Very stressful job. Sometimes left alone for hours in an environment where you have a lot of customer service plus other duties.,The company was more interested in getting production out of the employees rather than their welfare. The pay wasn't great. The hours kept dwindling down.,3,Former Employee,associate ,"Albert Lea, MN",3/8/12,2012,3,8
fast pased,"I was employed at Walmart for 2+ years, I enjoyed working with my crew, however the crew members always told me the Pharmacy Manger had it out for me and tried to get me to quit countless times. I have been coached and wrote up, I was not in the ""group"". I refused to kneel to that level, costing me my job. I was one of the best employees in the pharmacy, I knew my job, I did it well. When a series of unfortunate events falled upon me, Assad my Boss took advantage of my situation and gave my job to someone else.",1,Former Employee,pharmacy tech ,clarksville IN,3/8/12,2012,3,8
Decent Employer,Walmart has a pretty decent pay scale. But they are unfair when it comes to scheduling and the management highly favors certain employees but not others.,2,Former Employee,Cashier ,MN,3/8/12,2012,3,8
Wouldn't recommend to my worst enemy.,Only work here if you are extremely desperate. This place is a joke.,1,Current Employee,Vehicle Service Specialist ,"Altoona, IA",3/8/12,2012,3,8
nice enviroment friendly people,It was a nice place to work if you did not want to go anywhere. tryed to get more hours kept getting runaround on how they cant do that right now to worried about sales,3,Former Employee,matience ,"Plymouth,In",3/8/12,2012,3,8
Corporation grades are good but individual management needs work.,"I like everything about the company except the management. Some managers tend to bend the company's policies for their own success. Example; Not exersicing staffing schedules set by the company, using reverse phsycology to manipulate associates, take, take, take and no give, leaving associates feeling like the only thing there is to do in that company is what you are told and you have no say in it.",4,Former Employee,Department Manager ,"Homestead, FL then Linden, NJ",3/8/12,2012,3,8
Overworked and underpaid,I work night shift at Wal-Mart as an Inventory Assocaite. Everyone I work with is miserable with their jobs. They are not understanding of any life outside of the store and expect you to devote all of your time and eneregy to Wal-mart for very poor pay for a trillion dollar company.,1,Current Employee,Receiving Assocate ,"Norton, Virginai",3/8/12,2012,3,8
Current Employer,"Staff Pharmacist. Perform all duties of a pharmacist. Worked for CVS from 2003-2011 until I switched to Wal-Mart. It has been a beneficial switch, but I am trying to move and need help finding a job. I enjoy being a Wal-Mart Pharmacist.",5,Current Employee,Staff Pharmacist ,"Traveler's Rest, SC",3/8/12,2012,3,8
So So,Wal mart is one of the leading stores in america and the world but when it comes to communication they are not there yet. wal mart is a good spot to work if you can get over the fact that you have like 20 people telling you to do different things all at the same time,4,Former Employee,money center associate ,springhill,3/8/12,2012,3,8
wal-mart,"wal-mart, it a job that about it, you will be over work under pay and can't not get over time.",1,Former Employee,sale's ,london,3/8/12,2012,3,8
A place to call home,"I really enjoyed working for Walmart. I was there for 4 years. I started out in the pharmacy, then went to the backroom as an inventory control associate. This company is very family-oriented. I wish I would have never left, I really miss everyone I worked with.",4,Former Employee,Inventory Control Associate ,"Anniston, AL",3/7/12,2012,3,7
productive in fun workplace,"tthe manger are so disrepectful,rude and they didnt care about you",5,Former Employee,sales ,"dallas,tx",3/7/12,2012,3,7
Put out freight,"Help put out freight, help customers locate items that they are looking for, zone areas (infants/baby, boys, girls, woman and men) departments. I also help out in the jewerly department, shoe department and help check out customers",4,Current Employee,Sales Floor Assoicate ,"Madison,MS",3/7/12,2012,3,7
Ok Job... Every store is different with different mgmt and pay structures,"I was hired in 2008 at the Walmart in Richardson. It was the small grocery walmart. It was a very nice store. It was a ""test"" store with mostly an older and retired (or near retired) workforce working alongside young college students. I liked the job. It was laid back. Mgmt was cool. It had its little politics going on but nothing major. Child's play to me because I had worked in jobs with ""major"" political battles.Every store is drastically different with different management and pay structures. This store was like a small family type of store with the store manager personally taking an interest in making sure his employees were trained properly and treated well..Hard to come by that type of management. Walmart overrall is a pretty good company now. I guess they've been sued so much for everything ( I had read Walmart gets sued every day of the year) that they now pretty much know what's not allowed.Good job overrall. Crazy hours. Part time work. But ok.",4,Former Employee,Customer Service/Cashier ,"Richardson, Texas",3/7/12,2012,3,7
Productive environment.,Moderate amount of work for moderate compensation. Benefits were lack luster. Management was friendly and accommodating.,3,Former Employee,Seasonal Stocker ,"Burlington, NJ",3/7/12,2012,3,7
Challenging and fun workplace with a lot of caring associates,I thoroughly enjoy the challenge of keeping each customer happy. The associates that I work with have become my second family.,4,Current Employee,Customer Service Representative ,"Maple Grove, MN",3/7/12,2012,3,7
it was a nice workplace,Working here gave many opportunities and i really enjoyed working there.,3,Former Employee,"unloading trucks, stocking up the store ",griffin ga,3/7/12,2012,3,7
Fun Place to Work,A customer friendly and people friendly environment that give a lot to the employees,5,Former Employee,Truck Unloader ,"Fridley, MN",3/7/12,2012,3,7
Excellent start up place.,nice all the framework is already there. and the education is superb. only they need to not force down pay. its going down.,5,Former Employee,Dept. Manager ,Midland tx,3/7/12,2012,3,7
productive and fn workplace,"I really liked working at walmart, i really loved helping the customers and it was a fun workplace tho it would get really busy at times, you still have to keep it together and keep moving. They are understanding about medical issues and family issues if you need time off for a death in the family they understand.",3,Current Employee,cashier ,chaotte,3/7/12,2012,3,7
